location,text,hashtags,tweetcreatedts
"Los Angeles, CA","Trump and Senate Republicans have no interest in helping the American people through the COVID-19 pandemic.

Instead they are sidelining urgently needed relief, and their sole focus is to rush through a SCOTUS nominee who will destroy the ACA. https://t.co/tj0GBSTHrc",[],2020-10-06 22:40:55
New York,"Testing strategy can work with clear &amp; specific protocols that will ensure the safety of schools, healthcare facilities &amp; other high-risk settings. Thank you @ASlavitt for discussing rapid screening &amp; diagnostic testing. Read how we’re #MeetingThisMoment: https://t.co/OuwiulGq0i",[],2020-10-06 22:40:55
"Chicago via Tulsa, OK",Just the most reckless asshole. They need to replace him now. https://t.co/XG7Px1xH7j,[],2020-10-06 22:40:54
"New York, USA",note; only SENIOR REPUBLICANS and our MILITARY COMMANDERS have contracted   THE covid-19 virus.  NO DEMS!  was this virus spread by a spy?  https://t.co/xZJmmEyv0h,[],2020-10-06 22:40:53
"Los Angeles, CA","The economic impacts of COVID-19 are so far-reaching. Historically speaking, 2020 might require a few chapters in U.S. History books. https://t.co/d7XSMs4RDG",[],2020-10-06 22:40:51
"Los Angeles, CA","Last month, @ABC reporter @KayleeHartung shared her experience donating #plasma, &amp; what motivates her to do so.

The need for lifesaving plasma continues. If you are healthy &amp; have recovered from #covid19, learn more about donating convalescent plasma: https://t.co/ulzxlPeuHh https://t.co/ApM6cNICaV","[{'text': 'plasma', 'indices': [88, 95]}]",2020-10-06 22:40:48
"Hollywood, Los Angeles",I can't stop thinking about this? It scares me. There's a lot of valid criticism about SNL choosing to do live shows in the studio right now. This feels like a cartoonishly crazy risk to throw on top of all the risk that already exists? https://t.co/AuccWhB3xn,[],2020-10-06 22:40:47
"Los Angeles, CA","Something that we didn't see mentioned, if Nancy Pelosi was in the position to becoming acting president if Trump and Pence were incapacitated due to Covid-19, she'd have to resign her house seat in order to become acting president.",[],2020-10-06 23:00:03
"Brookyln ,New York","My condolences to the family of fashion designer Kenzo Takada, who has recently passed away from COVID-19",[],2020-10-06 23:00:02
Los Angeles,"Is it possible to feel bad for a deadly virus?  

#Covid_19 
#coronavirus https://t.co/JnMdqZmO6a","[{'text': 'Covid_19', 'indices': [50, 59]}, {'text': 'coronavirus', 'indices': [61, 73]}]",2020-10-06 23:00:02
"San Francisco, CA",BREAKING: White supremacist and top Trump advisor Stephen Miller has tested positive for Covid-19.,[],2020-10-06 23:00:01
"Chicago, IL",Arkansas Republican County Chair Dies of COVID-19 Weeks After His Committee Hosted Maskless Gathering https://t.co/D2U5v2YZ29 via @Yahoo,[],2020-10-06 23:00:01
"New York, NY","Trump Further Emboldens His Base After COVID-19 Diagnosis

Those who plan to vote for four more years of his antics have only grown louder and reinvigorated, especially on social media.

#Election2020 
#TrumpIsANationalDisgrace 

https://t.co/hyMHcSoSUv","[{'text': 'Election2020', 'indices': [187, 200]}, {'text': 'TrumpIsANationalDisgrace', 'indices': [202, 227]}]",2020-10-06 23:00:01
"Los Angeles, CA","#BTS’s performance at the Gyeongbokgung Palace, Korea’s most representative cultural heritage, was broadcasted on NBC #TheTonightShow. It was a new attempt to share the Korean heritage together with the world during the COVID-19 pandemic.

Check thread ▼▼▼ https://t.co/LOYklh0d95","[{'text': 'BTS', 'indices': [14, 18]}]",2020-10-06 22:59:58
"Los Angeles, CA","On the level that they are getting #Covid_19 in that White House, makes me think they don’t wash their hands, or their ass at this point . #StephenMiller  has coronavirus? He is a virus . https://t.co/k0O8VlP0SC","[{'text': 'Covid_19', 'indices': [35, 44]}, {'text': 'StephenMiller', 'indices': [139, 153]}]",2020-10-06 22:59:57
"New York, NY","Nancy Pelosi is asking for $2.4 Trillion Dollars to bailout poorly run, high crime, Democrat States, money that is in no way related to COVID-19. We made a very generous offer of $1.6 Trillion Dollars and, as usual, she is not negotiating in good faith. I am rejecting their...",[],2020-10-06 22:59:55
Western New York,"The Fake News Media refuses to discuss how good the Economy and Stock Market, including JOBS under the Trump Administration, are doing. We will soon be in RECORD TERRITORY. All they want to discuss is COVID 19, where they won’t say it, but we beat the Dems all day long, also!!!",[],2020-10-06 22:59:55
"Chicago, IL",What do you get with @realDonaldTrump as president? Watch the latest from @ProjectLincoln #Covid_19 https://t.co/UJd1lQo95C,"[{'text': 'Covid_19', 'indices': [105, 114]}]",2020-10-06 22:59:53
"Los Angeles, California ",Stephen Miller has tested positive for COVID-19,[],2020-10-06 22:59:52
"Miami, FL","Reminder that when we first reported that Stephen Miller's grandmother died of  COVID,  he denied it, despite  her kids statements and her death certificate https://t.co/kBz9aqUeNc",[],2020-10-06 22:59:51
"Chicago, IL","According to the @nytimes, the state of New Jersey currently has 211,129 reported cases of Covid-19. Want to check out which county in the state was impacted most during its peak? Check out my New Jersey COVID-19 dashboard on @tableau. https://t.co/VZRP8xL8Qi #uicdigital","[{'text': 'uicdigital', 'indices': [260, 271]}]",2020-10-06 22:59:50
"New York, USA","The president's doctor said that he's reporting no COVID-19 symptoms, but it's still not known if he has lung damage or pneumonia.
 
This comes as the president sent the stock market reeling after calling off negotiations over a stimulus deal.

@benstracy reports https://t.co/ht4Tk2LSDF",[],2020-10-06 22:59:46
"New York, NY",Nosferatu wearing a Stephen Miller skin suit has tested positive for covid-19,[],2020-10-06 22:59:45
New York,It takes a collective effort to ensure we meet the needs of all communities during these difficult times. Thank you @ASlavitt for discussing rapid screening and diagnostic testing with @rajshah on #InTheBubble. Read more on how we’re #MeetingThisMoment: https://t.co/WDL9uM56HR,[],2020-10-06 22:59:44
"Los Angeles, CA","JUST IN: Trump adviser Stephen Miller has tested positive for Covid-19, a senior admin. official says - @HallieJackson",[],2020-10-06 22:59:43
Los Angeles🔁London🔁Galway,Stephen Miller has tested positive for COVID-19,[],2020-10-06 22:59:41
"Tujunga, Los Angeles",(1/3) I am shocked and appalled by the President’s irresponsible comments likening Covid-19 to the flu and encouraging Americans not to take it too seriously.  Public health scientists and health providers all agree that Covid-19 is a serious and potentially deadly pandemic.,[],2020-10-06 22:59:41
"New York, NY USA","Alongside @Gavi and @WHO, we've launched COVAX to ensure equitable access to COVID-19 vaccines and end the acute phase of the pandemic by the end of 2021 ➡️ https://t.co/SRBUYKSXvz https://t.co/Pi070oxhUG",[],2020-10-06 22:59:39
"Miami, FL",GOP county chair in Arkansas dies from COVID-19 – his committee hosted a maskless gathering last month - https://t.co/2LB99dAs0h,[],2020-10-06 22:59:37
New York,"Testing strategy can work with clear &amp; specific protocols that will ensure the safety of schools, healthcare facilities &amp; other high-risk settings. Thank you @ASlavitt for discussing rapid screening &amp; diagnostic testing. Read how we’re #MeetingThisMoment: https://t.co/OuwiulGq0i",[],2020-10-06 22:59:36
"Los Angeles, CA","JUST IN: Trump adviser Stephen Miller has tested positive for Covid-19, a senior admin. official says - @HallieJackson",[],2020-10-06 22:59:35
"Los Angeles, CA","Donald Trump and his supporters' reaction to COVID-19 is indictment on white American pathology. 

That he is willing to kill us all by ignoring science shows there is something sick in the psyche of people who are willing to die to protect their whiteness--and access to it.",[],2020-10-06 22:59:35
Chicago USA,"JUST IN: Trump adviser Stephen Miller has tested positive for Covid-19, a senior admin. official says - @HallieJackson",[],2020-10-06 22:59:35
"New York, NY","Cuomo's office just released bigger maps of the COVID-19 clusters.

Brooklyn: https://t.co/pbERpAwFFa
Orange: https://t.co/DNJcWw5McS
Queens 1: https://t.co/eHT5ojHoOI
Queens 2: https://t.co/ymODGlB2Pr
Rockland: https://t.co/VVwfqytonI
Broome: https://t.co/tfNRgULRSS",[],2020-10-06 22:59:34
Los Angeles,Stephen Miller has COVID-19. Couldn't happen to a nicer guy.,[],2020-10-06 22:59:33
"Chicago, IL","And now 17, that’s SEVENTEEN, individuals linked to WH and campaign who have tested positive for covid-19.",[],2020-10-06 22:59:33
New York,"NEWS: Stephen Miller has tested positive for COVID-19, per a senior administration official. He's been working remotely for the last five days and has been self-isolating, testing negative every day through yesterday, per official. Today he tested positive. - via @HallieJackson",[],2020-10-06 22:59:32
Los Angeles,"Virginia governor develops mild covid-19 symptoms, scorns Trump for downplaying disease

https://t.co/OncssOGU5d",[],2020-10-06 22:59:32
"San Francisco, CA",BREAKING: White supremacist and top Trump advisor Stephen Miller has tested positive for Covid-19.,[],2020-10-06 22:59:31
"Los Angeles, CA","202,040+ Americans have lost their lives to COVID-19. These are their names.

https://t.co/vKrsgnHidZ https://t.co/relRWKEvOQ",[],2020-10-06 22:59:29
"Los Angeles, CA","COVID-19 requires a certain ""critical mass"" viral load to test positive.  Your body can fight it off but in the cases where your body loses you *eventually* test positive as the virus runs rampant in your system.

Symptoms develop and change based on the viral load.",[],2020-10-06 22:59:29
"Los Angeles, CA",Stephen Miller has tested positive for COVID-19,[],2020-10-06 22:59:29
New York,"BREAKING: Trump adviser Stephen Miller has tested positive for COVID-19, bringing the number of people in the White House &amp; Trump campaign known to have contracted the infection to 18 in the last week",[],2020-10-06 22:59:28
"San Francisco, CA","And now 17, that’s SEVENTEEN, individuals linked to WH and campaign who have tested positive for covid-19.",[],2020-10-06 22:59:28
Chicago ,"@HallieJackson Can we now get good policy from WH after it’s main guy down with Covid19? I meant he was there star senior advisor for policy for POTUS. I guess, it’s steep expectations to have compassion from the administration. #GetWellSoon #stimulus #coronavirus","[{'text': 'GetWellSoon', 'indices': [229, 241]}, {'text': 'stimulus', 'indices': [242, 251]}, {'text': 'coronavirus', 'indices': [252, 264]}]",2020-10-06 22:59:26
Greater New York City area,@DWUhlfelderLaw WRONG! Covid-19 has been infected by Stephen Miller.,[],2020-10-06 22:59:25
"New York, NY","BREAKING: Trump adviser Stephen Miller has tested positive for COVID-19, bringing the number of people in the White House &amp; Trump campaign known to have contracted the infection to 18 in the last week",[],2020-10-06 22:59:25
"Chicago, IL","Julie Davis was not afforded the same medical treatment as Trump. She taught at Norwood Elementary School in Stanly County, North Carolina and died from Covid-19. 
https://t.co/fNAfqn3hWK https://t.co/Pcj0W8qHGl",[],2020-10-06 22:59:24
new york city,"JUST IN: Trump adviser Stephen Miller has tested positive for Covid-19, a senior admin. official says - @HallieJackson",[],2020-10-06 22:59:23
"Los Angeles, CA","JUST IN: Trump adviser Stephen Miller has tested positive for Covid-19, a senior admin. official says - @HallieJackson",[],2020-10-06 22:59:22
Chicago,Co-living and rental-apartment management company Common is the latest to wager it can expand despite Covid-19 https://t.co/FYTvO89aoV via @WSJ,[],2020-10-06 22:59:22
Chicago,"JUST IN: Trump adviser Stephen Miller has tested positive for Covid-19, a senior admin. official says - @HallieJackson",[],2020-10-06 22:59:19
Los Angeles,"US: sees south korea and china doing economically decent, after massive covid-19 testing and 8 week lockdowns

US: i want that

MD'S: then do testing and 8 week mandatory lockdown

US: no

MD's: then you--

US: why am I sick, i want economy

MD's: you have to--

US: stores open",[],2020-10-06 22:59:19
New York City,"BREAKING: WH adviser Stephen Miller has tested positive for #coronavirus, per a source close to him. @kaitlancollins reports","[{'text': 'coronavirus', 'indices': [76, 88]}]",2020-10-06 22:59:19
"San Francisco, CA","""Poll: 74 percent of voters want Senate to take on COVID-19 relief before SCOTUS nominee""
https://t.co/d4gr11WkET",[],2020-10-06 22:59:18
"New York, NY",Republicans will do anything to fill the SCOTUS vacancy. @AnneMilgram and I discuss how the COVID-19 outbreak in Washington could impact Amy Coney Barrett’s confirmation process on a new @cafedotcom Insider: https://t.co/byWBKTFlBR https://t.co/KTED5M8Emj,[],2020-10-06 22:59:15
"New York, NY",BREAKING: White supremacist and top Trump advisor Stephen Miller has tested positive for Covid-19.,[],2020-10-06 22:59:13
"Miami, FL","JUST IN: Trump Rips Mainstream Media for Virus Obsession, Says All They ‘Want to Discuss is CoVID-19’ https://t.co/IEYz7gLmvU",[],2020-10-06 22:59:12
"San Francisco, CA",Stephen Miller has tested positive for COVID-19,[],2020-10-06 22:59:12
"Miami, FL","BREAKING:  Twitter has just censored Trump's false tweet downplaying Covid-19, saying that it is spreading ""harmful information"".

Yes, the President is trying to harm Americans  

Thank you Twitter.  

#TrumpIsANationalDisgrace",[],2020-10-06 22:59:11
"Chicago, IL",Stephen Miller has tested positive for COVID-19,[],2020-10-06 22:59:11
"Los Angeles, CA","Donald Trump and his supporters' reaction to COVID-19 is indictment on white American pathology. 

That he is willing to kill us all by ignoring science shows there is something sick in the psyche of people who are willing to die to protect their whiteness--and access to it.",[],2020-10-06 22:59:08
"Los Angeles, CA",There’s a lot to unpack about the implications of #Covid_19 for admissions. Tune into @KPCC Wed at 10:20amPT where I’ll be talking with @LarryMantle &amp; @jillrep on @AirTalk. https://t.co/DcjCf6TegP,"[{'text': 'Covid_19', 'indices': [50, 59]}]",2020-10-06 22:59:07
"New York, NY,USA",GOP county chair in Arkansas dies from COVID-19 – his committee hosted a MASKLESS gathering last month.,[],2020-10-06 22:59:06
New York,And another one: Stephen Miller has reportedly tested positive for COVID-19.,[],2020-10-06 22:59:06
"New York, NY","BREAKING:  Joe Biden has once again tested negative for Covid-19.

Who else is super relieved like me?",[],2020-10-06 22:59:04
chicago,"To get anywhere w anything politically, we have to start w the realities of COVID-19 &amp; our grief about it that is being suppressed. There is a reason some people are determined to prevent us from processing the magnitude of our losses. Bc we would be much more powerful if we did.",[],2020-10-06 22:58:59
"New York, NY",nobody recovers from COVID-19 in 3 days ... specially not a 74 year old man,[],2020-10-06 22:58:58
New York,"#Texas we must vote these corrupt #Russian politicians out! 

They are killing us! ⁦@SenTedCruz⁩ is a HUGE part of the problem. ⁦@DumpTrumpTexas⁩

San Antonio Pastor John Hagee Has Coronavirus and Residents Are Worried About COVID-19
 https://t.co/Uj0NIk8vLf","[{'text': 'Texas', 'indices': [16, 22]}, {'text': 'Russian', 'indices': [50, 58]}]",2020-10-06 22:58:58
"New York, NY",Let’s get this straight! More people have COVID-19 in the White House than in the whole country of New Zealand. #TrumpLied200KDied,[],2020-10-06 22:58:57
"New York, NY",Stephen Miller has tested positive for COVID-19,[],2020-10-06 22:58:57
"Miami, FL","@chrislhayes Yep.

GOP county chair in Arkansas dies from COVID-19 – his committee hosted a maskless gathering last month - https://t.co/2LB99dAs0h",[],2020-10-06 22:58:56
"New York, New York","Breaking News: The chairman of an Arkansas Republican group that held a maskless event has died from COVID-19

It is what it is",[],2020-10-06 22:58:56
"New York, USA",Did Stephen Miller test positive for COVID-19?,[],2020-10-06 22:58:55
"Chicago, Illinois","Trump’s stance on #Coronavirus is basically the same as FDR’s stance on the Depression: “We have nothing to fear so much as fear itself.” By contrast, the media and the Democrats have a different stance: “Be very afraid”","[{'text': 'Coronavirus', 'indices': [36, 48]}]",2020-10-06 22:58:54
"Los Angeles, CA","And now 17, that’s SEVENTEEN, individuals linked to WH and campaign who have tested positive for covid-19.",[],2020-10-06 22:58:54
Los Angeles,"Doctors with experience treating COVID-19 patients warn that Trump could experience the worst symptoms in the next week.

“For the next few days, I’d want him 50 feet away from an ICU, not a helicopter ride,” one doctor said. https://t.co/6EEN5iNVHl",[],2020-10-06 22:58:53
Chicago USA,"JUST IN: Trump adviser Stephen Miller has tested positive for Covid-19, a senior admin. official says - @HallieJackson",[],2020-10-06 22:58:51
"New York, NY","🚨BREAKING: Stephen Miller tests POSITIVE for the #coronavirus.

His *own wife* tested positive months ago, yet it took the WH #SuperSpreader event for Stephen to test positive.🧐

#GOPSuperSpreaders #COVID19 #TrumpVirus #WhiteHouseVirus https://t.co/v5MLZwhGQE","[{'text': 'coronavirus', 'indices': [68, 80]}]",2020-10-06 22:58:50
New York,BREAKING: White supremacist and top Trump advisor Stephen Miller has tested positive for Covid-19.,[],2020-10-06 22:58:48
los angeles - toluca lake,AOC excoriates Trump for walking away from COVID-19 relief talks: ‘What an anti-everybody agenda looks like’ https://t.co/mSZgixBmna,[],2020-10-06 22:58:48
Suburban Chicago girl,"JUST IN: Trump adviser Stephen Miller has tested positive for Covid-19, a senior admin. official says - @HallieJackson",[],2020-10-06 22:58:47
Chicago,"JUST IN: Trump adviser Stephen Miller has tested positive for Covid-19, a senior admin. official says - @HallieJackson",[],2020-10-06 22:58:46
"Los Angeles, CA","JUST IN: Trump adviser Stephen Miller has tested positive for Covid-19, a senior admin. official says - @HallieJackson",[],2020-10-06 22:58:44
"Chicago, IL",COVID-19 has tested positive for Stephen Miller,[],2020-10-06 22:58:43
"New York, NY","President Trump is back … to downplaying COVID-19.

The virus has killed 210K Americans and infected 7.5M more. The White House itself is now a hotspot. And yet, the commander-in-chief has returned from the hospital only to continue a misinformation campaign. https://t.co/KDUOmPT8PK",[],2020-10-06 22:58:41
"New York, USA",Stephen Miller has tested positive for COVID-19,[],2020-10-06 22:58:40
"San Francisco, CA","BREAKING: Trump adviser Stephen Miller has tested positive for COVID-19, bringing the number of people in the White House &amp; Trump campaign known to have contracted the infection to 18 in the last week",[],2020-10-06 22:58:40
New York,If you are too afraid to book a date with me because of Covid-19. I also offer affordable webcam shows mmmmmm ya. https://t.co/WPSqBN0E2T,[],2020-10-06 22:58:39
"Los Angeles, CA","Stephen Miller has COVID-19? 
I really don’t have the words to express my sympathy.",[],2020-10-06 22:58:38
"New York, USA","Just 40% of all distinct CUSIPs that have traded so far in 2020 have a COVID-19 related disclosure attached to them, leading some to wonder why all issuers aren’t disclosing COVID-19 risks. https://t.co/3EefKAgiQB",[],2020-10-06 22:58:37
KC LA Chicago ,@PaulStanleyLive I was on them after complications to a re-built knee. My husband told the surgeon when he called to check in on me-“well I have hidden all the knives” I wish POTUS a smooth recovery. Covid-19 stinks,[],2020-10-06 22:58:36
"Los Angeles, CA",Pence has been in contact with multiple people who tested positive for COVID-19. https://t.co/cL2OJVUghf,[],2020-10-06 22:58:34
"Chicago, Il","Susan Collins, vulnerable Republican in Maine, says of Trump’s call to halt stimulus talks: “Waiting until after the election to reach an agreement on the next Covid-19 relief package is a huge mistake.”",[],2020-10-06 22:58:34
New York,"CDC update acknowledges COVID-19 can spread across more than 6 feet, especially indoors and in areas with poor ventilation.

https://t.co/Nrs3gU3GAr",[],2020-10-06 22:58:32
"San Francisco, CA","BREAKING: Trump adviser Stephen Miller has tested positive for COVID-19, bringing the number of people in the White House &amp; Trump campaign known to have contracted the infection to 18 in the last week",[],2020-10-06 22:58:32
Chicago,BREAKING: The chairman of an Arkansas Republican group that held maskless event has died from COVID-19,[],2020-10-06 22:58:32
"Chicago, IL","My condolences to the family of fashion designer Kenzo Takada, who has recently passed away from COVID-19",[],2020-10-06 22:58:31
Chicago,The commercial real estate foreclosure wave is coming. “It’s just a question of how bad is it going to be.” https://t.co/DVu1HDzfxl @KonradPutzier  @WSJ,[],2020-10-06 22:58:31
New York,"As the waves of COVID rise and fall, lessons from past disasters and epidemics can offer valuable insights for recovery. This study by @UNDPasiapac highlights learnings from past disasters and features 10 lessons and good practices from the region: https://t.co/Dzqz9lGEJv https://t.co/AkR1rFKhBo",[],2020-10-06 22:58:30
"Los Angeles, CA","BREAKING: Trump adviser Stephen Miller has tested positive for COVID-19, bringing the number of people in the White House &amp; Trump campaign known to have contracted the infection to 18 in the last week",[],2020-10-06 22:58:29
"New York City, PA ",Covid-19 Live Updates: Trump Moves to End Talks With Democrats on Stimulus Package - The New York Times.   Remove Little Hands Mussolini Trump and ALL REPUBLICANS in November.  https://t.co/4lT0FZCdtx,[],2020-10-06 22:58:27
"Los Angeles, CA","BREAKING: Trump adviser Stephen Miller has tested positive for COVID-19, bringing the number of people in the White House &amp; Trump campaign known to have contracted the infection to 18 in the last week",[],2020-10-06 22:58:27
"Los Angeles, CA📍","JUST IN: Trump adviser Stephen Miller has tested positive for Covid-19, a senior admin. official says - @HallieJackson",[],2020-10-06 22:58:26
Los Angeles,Trump is dead because of COVID-19.. https://t.co/LPiXDL6iKU,[],2020-10-06 22:58:26
"Hell's Kitchen, New York City","Moderna slowed down its late-stage COVID-19 vaccine trial after contractors reportedly didn’t enroll enough participants from Black, Latino and Native American communities.
https://t.co/XOhmHSuye4",[],2020-10-06 22:58:25
New York,"NEWS: Stephen Miller has tested positive for COVID-19, per a senior administration official. He's been working remotely for the last five days and has been self-isolating, testing negative every day through yesterday, per official. Today he tested positive. - via @HallieJackson",[],2020-10-06 22:58:25
"New York, USA","@realDonaldTrump @realDonaldTrump what is section 230? Would you like to elaborate? And do you understand it’s’ implications to all of us that it impacts? Would enjoy your response.

More importantly, I hope you, Melania and others that have tested positive for COVID-19 are doing well.",[],2020-10-06 22:58:24
Los Angeles ,"JUST IN: The military aide who carries the ""nuclear football"" for the president, tested positive for COVID-19 and traveled with Donald Trump when he went to New Jersey last Thursday. (ABC News)",[],2020-10-06 22:58:24
"San Francisco, CA.(USA)",California congressman announces he tested positive for Covid-19 - CNN Politics https://t.co/dST8gz3r6I,[],2020-10-06 22:58:22
"Long Island, New York",@HallieJackson @soledadobrien The #WhiteHouseVirus is claiming victims daily. Pence is not “all clear” yet. He may test #coronavirus positive any day. Kamala Harris must be protected from these virus spreaders. #VOTE,"[{'text': 'WhiteHouseVirus', 'indices': [34, 50]}, {'text': 'coronavirus', 'indices': [120, 132]}, {'text': 'VOTE', 'indices': [211, 216]}]",2020-10-06 22:58:21
"San Francisco, California",". @Capgemini has a major new piece of research out today, tracking the impact of #climatechange
policies and covid-19 on Europe's utilities sector. 

Here, we round up the key takeaways. 

https://t.co/dbHyc3Lsnb","[{'text': 'climatechange', 'indices': [91, 105]}]",2020-10-06 22:58:19
New York,BREAKING: Stephen Miller has tested positive for COVID-19.,[],2020-10-06 22:58:18
"East Village, New York, NY","NEWS: Stephen Miller has tested positive for COVID-19, per a senior administration official. He's been working remotely for the last five days and has been self-isolating, testing negative every day through yesterday, per official. Today he tested positive. - via @HallieJackson",[],2020-10-06 22:58:18
"New York, USA","JUST IN: Trump adviser Stephen Miller has tested positive for Covid-19, a senior admin. official says - @HallieJackson",[],2020-10-06 22:58:17
"New York, NY","BREAKING: Trump adviser Stephen Miller has tested positive for COVID-19, bringing the number of people in the White House &amp; Trump campaign known to have contracted the infection to 18 in the last week",[],2020-10-06 22:58:16
"San Francisco, CA","Cuomo used a picture of a 2006 religious gathering while discussing the problems of mass religious gatherings during COVID-19.
https://t.co/1tZ4nWX8pr",[],2020-10-06 22:58:16
"Miami, FL (and always roaming)",Trump returned to his flawed comparison between COVID-19 and seasonal flu.  COVID-19 has killed more people in the U.S. than the past five flu seasons combined. And the pandemic is still ongoing. https://t.co/IErBLXWzxK,[],2020-10-06 22:58:16
