location,text,hashtags,tweetcreatedts
"New York, NY","This is a biological warfare! America’s top military official and other members of the Department of Defense’s Joint Chiefs of Staff are isolating after a military official tested positive for COVID-19, or the CCP virus! #CCPVirus",[],2020-10-06 20:12:42
"Los Angeles, CA",America Unmasked #CoronaVirus VS #Racism Virus #documentary https://t.co/B47StVEs4c via @YouTube,"[{'text': 'CoronaVirus', 'indices': [17, 29]}, {'text': 'Racism', 'indices': [33, 40]}, {'text': 'documentary', 'indices': [47, 59]}]",2020-10-06 20:12:40
"Chicago, IL","Is Trump trying to be Jimmy Carter? His COVID-19 mask position is opposed by 70% of population, &amp; now he's walking away from stimulus talks as millions are facing new layoffs. Biden could get 350+ Electoral Votes.",[],2020-10-06 20:12:36
"Chicago, IL","New: There are now 123 front-line workers in the Capitol complex who have have tested positive—or are presumed positive—for COVID-19, according to House Admin GOP Spokesperson Ashley Phelps.

Story coming.",[],2020-10-06 20:12:35
NYC via LA and Chicago,"I tested positive for COVID-19 this past Friday while on assignment at the White House the weekend before covering the Supreme Court nominee announcement in the Rose Garden.

I am quarantining in my apartment in DC and am beginning to feel better, and of course staying positive! https://t.co/OPFYvM6KJ7",[],2020-10-06 20:12:35
"Chicago, Illinois, USA","Biden tested negative for COVID-19 today, according to pool report: “Vice President Biden underwent PCR testing for COVID-19 today and COVID-19 was not detected.”",[],2020-10-06 20:12:34
"New York, NY","As Trump calls off negotiations over COVID-19 relief package, educators express alarm over looming state budget cuts https://t.co/OY55AjSEcB",[],2020-10-06 20:12:34
New York City,"In 2018, 75% of people ages 65 and older reported receiving a #FluVaccine the previous winter.
 
But smaller shares of Black (67%) and Hispanic (70%) older adults reported receiving a flu vaccination compared to White (76%) older adults. https://t.co/zdkd1ym5fz https://t.co/ygCsCJYWmh","[{'text': 'FluVaccine', 'indices': [71, 82]}]",2020-10-06 20:12:33
"New York & Sedona, AZ",Poll: 74 percent of voters want Senate to take on COVID-19 relief before SCOTUS nominee https://t.co/sRBRRKy9ky https://t.co/c8Le58UhjW,[],2020-10-06 20:12:32
"New York, NY","Recent research out on soybean oil shows it’s causing obesity and neurological damage. It is in almost every packaged processed product out there - because it is cheap for food manufacturers to use. 

If it comes out of a can or a box, you might want to think twice.

#health https://t.co/5ThxsDkxrD",[],2020-10-06 20:12:30
"New York, USA","Nancy Pelosi is asking for $2.4 Trillion Dollars to bailout poorly run, high crime, Democrat States, money that is in no way related to COVID-19. We made a very generous offer of $1.6 Trillion Dollars and, as usual, she is not negotiating in good faith. I am rejecting their...",[],2020-10-06 20:12:29
New York City,"""Poll: 74 percent of voters want Senate to take on COVID-19 relief before SCOTUS nominee""
https://t.co/d4gr11WkET",[],2020-10-06 20:12:28
Los Angeles,So now covid has become a punchline for the republican elite.  Just when you thought they could not get any lower.  They are literally laughing at dead bodies.  #Covid_19 #RepublicansAreDestroyingAmerica,"[{'text': 'Covid_19', 'indices': [161, 170]}, {'text': 'RepublicansAreDestroyingAmerica', 'indices': [171, 203]}]",2020-10-06 20:12:27
"Chicago, IL","Pool report: ""Just in, according to the campaign: 'Vice President Biden underwent PCR testing for COVID-19 today and COVID-19 was not detected.'""",[],2020-10-06 20:12:24
"Los Angeles, CA","Megapastor John Hagee is perhaps best known outside Evangelical circles for calling marriage equality “two disturbed people playing house” and Hurricane Katrina “the judgment of God” for the city’s “level of sin.”

 https://t.co/XnuHwlKahI via @thedailybeast",[],2020-10-06 20:12:24
"San Francisco, CA","Recently, millions of people have lost their jobs due to #COVID-19. Job loss can mean loss of health insurance. For people w/ cancer, losing a job is especially challenging bc of the costs of cancer TX. Read this @CancerDotNet blog for tips on how to cope: https://t.co/KmugcYx1oi","[{'text': 'COVID', 'indices': [71, 77]}]",2020-10-06 20:12:24
"New York, USA",@MaddowBlog Incredibly difficult to find a quick Covid-19 test in NY. We need to have these easily accessible to all.,[],2020-10-06 20:12:17
"San Francisco, CA","@realDonaldTrump Tell us again not to be afraid! A family member of mine JUST DIED from COVID-19. In my hometown hospital, which has been at capacity for weeks. His wife, also infected with COVID-19, is in the same hospital!! Tell us again how COVID-19 will not dominate! https://t.co/yJ9xq5OjX4",[],2020-10-06 20:12:16
"Chicago, IL",nobody recovers from COVID-19 in 3 days ... specially not a 74 year old man,[],2020-10-06 20:12:16
"San Francisco, CA","New: There are now 123 front-line workers in the Capitol complex who have have tested positive—or are presumed positive—for COVID-19, according to House Admin GOP Spokesperson Ashley Phelps.

Story coming.",[],2020-10-06 20:12:14
"Los Angeles, CA",nobody recovers from COVID-19 in 3 days ... specially not a 74 year old man,[],2020-10-06 20:12:14
Los Angeles,"New: There are now 123 front-line workers in the Capitol complex who have have tested positive—or are presumed positive—for COVID-19, according to House Admin GOP Spokesperson Ashley Phelps.

Story coming.",[],2020-10-06 20:12:14
"New York, USA","@MaraSkarbek @Andreas_Hopf @FinancialTimes @hallbenjamin The treatment that completely eliminated the Corona virus was discovered, and the North Korean state contacted me and offered me a sum of twenty million dollars, and I refused because I learned its scheme through my treatment of Covid 19, it will occupy the world.",[],2020-10-06 20:12:13
"New York, USA",Congratulations China for enslaving people and making it look humane.  #parody #artist #Halloween #SNL #memes #comedy #youtube #animation #gaming #twitch #Election2020 #hiphop #actor #TuesdayThoughts #popmusic #writer #politics #poetry #funny #horror #coronavirus #director,"[{'text': 'parody', 'indices': [71, 78]}, {'text': 'artist', 'indices': [79, 86]}, {'text': 'Halloween', 'indices': [87, 97]}, {'text': 'SNL', 'indices': [98, 102]}, {'text': 'memes', 'indices': [103, 109]}, {'text': 'comedy', 'indices': [110, 117]}, {'text': 'youtube', 'indices': [118, 126]}, {'text': 'animation', 'indices': [127, 137]}, {'text': 'gaming', 'indices': [138, 145]}, {'text': 'twitch', 'indices': [146, 153]}, {'text': 'Election2020', 'indices': [154, 167]}, {'text': 'hiphop', 'indices': [168, 175]}, {'text': 'actor', 'indices': [176, 182]}, {'text': 'TuesdayThoughts', 'indices': [183, 199]}, {'text': 'popmusic', 'indices': [200, 209]}, {'text': 'writer', 'indices': [210, 217]}, {'text': 'politics', 'indices': [218, 227]}, {'text': 'poetry', 'indices': [228, 235]}, {'text': 'funny', 'indices': [236, 242]}, {'text': 'horror', 'indices': [243, 250]}, {'text': 'coronavirus', 'indices': [251, 263]}, {'text': 'director', 'indices': [264, 273]}]",2020-10-06 20:12:13
"Chicago, IL",A 16 second look into every possible way to contract and spread COVID-19 https://t.co/ZEI6dcfUAC,[],2020-10-06 20:12:12
"San Francisco, CA","In a new Conversations with Entrepreneurs, we discuss the impact of COVID-19 on #fintech with @Fundbox CEO @PrashantFuloria. Watch now: https://t.co/IeSXWXMC8l","[{'text': 'fintech', 'indices': [99, 107]}]",2020-10-06 20:12:11
Los Angeles,Please do not let the the wonders of her cell line detract from the fact that they were STOLEN without permission and are still being used today in research with COVID-19 https://t.co/jjqlWHb53k,[],2020-10-06 20:12:11
"Wa. state, Indiana, Chicago",The Attorney General again tested negative for COVID-19 today. He has taken five tests since Friday morning and all have returned negative.,[],2020-10-06 20:12:11
"Los Angeles, CA",nobody recovers from COVID-19 in 3 days ... specially not a 74 year old man,[],2020-10-06 20:12:10
"Los Angeles, CA","NEW: House Speaker Nancy Pelosi said President Trump “showed his true colors” by ending the coronavirus relief aid talks, and said he was putting himself first “at the expense of the country, with the full complicity of GOP Members of Congress.” https://t.co/AKfBEfK9BP",[],2020-10-06 20:12:10
upstate New York ,"When did Trump have his last negative COVID-19 test? 

And why is the White House so adamant about keeping it a secret?",[],2020-10-06 20:12:09
"chicago, il","Mayor Lori Lightfoot says she has to be careful while choosing her words when responding to President Donald Trump's statement urging people ""not to fear COVID-19.""

The president presided over a ""super spreader event,"" she says.

His behavior is unfortunate, she says.",[],2020-10-06 20:12:09
Los Angeles/New York,"Pool report: ""Just in, according to the campaign: 'Vice President Biden underwent PCR testing for COVID-19 today and COVID-19 was not detected.'""",[],2020-10-06 20:12:07
"Chicago, IL","How is trump supposed to keep America safe from COVID-19 when he can't even keep the White House safe?

NARRATOR: He cannot keep ANYONE safe.",[],2020-10-06 20:12:06
"New York, USA","Pool report: ""Just in, according to the campaign: 'Vice President Biden underwent PCR testing for COVID-19 today and COVID-19 was not detected.'""",[],2020-10-06 20:12:06
"San Francisco, CA","New: There are now 123 front-line workers in the Capitol complex who have have tested positive—or are presumed positive—for COVID-19, according to House Admin GOP Spokesperson Ashley Phelps.

Story coming.",[],2020-10-06 20:12:06
"Los Angeles, CA","If Trump is receiving Dexamethasone, a steroid, the CDC suggest that he could be infectious for 20 days. As an ICU nurse, dealing with Covid-19, Trump should be in quarantine for at least 20 days. Why is no one talking about that? @jaketapper  @drsanjaygupta @CNN",[],2020-10-06 20:12:03
"New York, NY",Communist Chinese Party Virus=COVID-19 https://t.co/6VPzbBuXnS,[],2020-10-06 20:12:03
Los Angeles,"New: There are now 123 front-line workers in the Capitol complex who have have tested positive—or are presumed positive—for COVID-19, according to House Admin GOP Spokesperson Ashley Phelps.

Story coming.",[],2020-10-06 20:12:02
"New York, USA","BREAKING:  Joe Biden has once again tested negative for Covid-19.

Who else is super relieved like me?",[],2020-10-06 20:30:34
"New York, USA",Covid-19 has killed more people in eight months than the flu did in the last five flu seasons combined https://t.co/0g9BfNiRM0,[],2020-10-06 20:30:32
"Los Angeles, CA",@seanhannity How Fox News and Trump are spinning lethality of Covid-19 https://t.co/cNhLtteED3,[],2020-10-06 20:30:32
"Los Angeles, CA","In 2014, Obama sent troops &amp; doctors to Africa to stop Ebola before it spread outside the continent. As you can see from below, #Trump's solution would have been much like this year's #coronavirus one, &amp; the results would have been equally short-sighted &amp; deadly.
#MAGA2020 https://t.co/AS5X7zY6QT","[{'text': 'Trump', 'indices': [132, 138]}, {'text': 'coronavirus', 'indices': [188, 200]}, {'text': 'MAGA2020', 'indices': [276, 285]}]",2020-10-06 20:30:29
"New York, USA","New: There are now 123 front-line workers in the Capitol complex who have have tested positive—or are presumed positive—for COVID-19, according to House Admin GOP Spokesperson Ashley Phelps.

Story coming.",[],2020-10-06 20:30:29
"Los Angeles, CA",Joint Chiefs Chiefs of Staff all test negative for Covid-19: Pentagon,[],2020-10-06 20:30:29
"New York, New York",COVID-19 survivor meets the plasma donor that saved his life https://t.co/srQ7AXAunj https://t.co/mllcZrQEe2,[],2020-10-06 20:30:26
Chicago,"New: There are now 123 front-line workers in the Capitol complex who have have tested positive—or are presumed positive—for COVID-19, according to House Admin GOP Spokesperson Ashley Phelps.

Story coming.",[],2020-10-06 20:30:23
"San Francisco, CA","When you die of COVID-19, you die alone. https://t.co/egpA4u9tNT",[],2020-10-06 20:30:21
"New York, NY",COVID-19 National Week of Mourning Starts Sunday @LizCancerHealth https://t.co/VVxtjasgeh #advocacy #coronavirus #COVID19,"[{'text': 'advocacy', 'indices': [90, 99]}, {'text': 'coronavirus', 'indices': [100, 112]}, {'text': 'COVID19', 'indices': [113, 121]}]",2020-10-06 20:30:20
"San Francisco, CA",The 10 Essential Steps for Crisis Management. #ClinicalTrials #ClinicalResearch #Covid-19 #CrisisManagement https://t.co/nLfG50aukz @FCR_News_Today https://t.co/jqbTMLDShy,"[{'text': 'ClinicalTrials', 'indices': [46, 61]}, {'text': 'ClinicalResearch', 'indices': [62, 79]}, {'text': 'Covid', 'indices': [80, 86]}, {'text': 'CrisisManagement', 'indices': [90, 107]}]",2020-10-06 20:30:19
"New York, NY",COVID-19 National Week of Mourning Starts Sunday @LizCancerHealth https://t.co/MjFO7Fv9AW #advocacy #coronavirus #COVID19,"[{'text': 'advocacy', 'indices': [90, 99]}, {'text': 'coronavirus', 'indices': [100, 112]}, {'text': 'COVID19', 'indices': [113, 121]}]",2020-10-06 20:30:19
New York,Arkansas Republican County Chair Dies of COVID-19 Weeks After His Committee Hosted Maskless Gathering https://t.co/aGTl446QDt via @Yahoo,[],2020-10-06 20:30:18
"New York, London, Utrecht, ","Vayyar announced that its 4D imaging sensors will be used by the Israeli government to fight the spread of COVID-19.Learn more in the webinar Technology Roadmaps for Passenger Monitoring, Wellness &amp; Safety. Register here : https://t.co/Ms6hQw9FQM https://t.co/Hd3hEpllZd",[],2020-10-06 20:30:18
"Cleveland, OH & Miami Bch, FL","President Trump walks out of military hospital after three-day stay for COVID-19 treatment, will continue recovery at White House. https://t.co/dQXQmmTcs5",[],2020-10-06 20:30:18
new york,"7,192 Georgians have died from COVID-19. https://t.co/iAb3AthxcQ",[],2020-10-06 20:30:17
"Los Angeles, CA",#HPV #vaccine reduces the risk of cervical #cancer by nearly 90% in a study of nearly 1.7 million vaccinated and unvaccinated women in Sweden https://t.co/DN1B2Ippwi #VaccinesSaveLives #VaccinesWork https://t.co/qRJhgCndre,"[{'text': 'HPV', 'indices': [0, 4]}, {'text': 'vaccine', 'indices': [5, 13]}, {'text': 'cancer', 'indices': [43, 50]}, {'text': 'VaccinesSaveLives', 'indices': [166, 184]}, {'text': 'VaccinesWork', 'indices': [185, 198]}]",2020-10-06 20:30:16
"New York, NY","“Teens and older adults are the two loneliest age groups in America,” - Learn more about a program that is fostering intergenerational, #multiracial, virtual friendships amid the #COVID19 pandemic like the one shared in this article! ➡️ https://t.co/k8VGhJqpuv via @NextAvenue https://t.co/6NGnRbbxz4","[{'text': 'multiracial', 'indices': [136, 148]}, {'text': 'COVID19', 'indices': [179, 187]}]",2020-10-06 20:30:16
San Francisco Bay Area,@GOP How many GOP members are NOW sick with COVID-19?  Have you guys decided that it is your Leader who is responsible yet?  Or are you going to blame someone else?,[],2020-10-06 20:30:16
"Chicago, IL","New: There are now 123 front-line workers in the Capitol complex who have have tested positive—or are presumed positive—for COVID-19, according to House Admin GOP Spokesperson Ashley Phelps.

Story coming.",[],2020-10-06 20:30:14
"Chicago, IL",@realDonaldTrump now that you have miraculously recovered from COVID-19. Let’s talk about your taxes again. Shall we? Didn’t think your little stunt would make us forget would it? 🙄,[],2020-10-06 20:30:14
"Los Angeles, CA",Thirteen employees at a restaurant in Minneapolis are in quarantine after catering a party attended by President Trump on September 30 https://t.co/79wwxrLrv4 https://t.co/3V6zC0MF9t,[],2020-10-06 20:30:11
New York,"National security: The Joint Chiefs of Staff are quarantining after attending meetings at the Pentagon with a top Coast Guard commander who tested positive this week, defense officials said. https://t.co/e1RkLMrNQi",[],2020-10-06 20:30:11
"New York, NY",The power of hugs and human touch: https://t.co/1d4oHRvSw9 #Health #Wellness #MentalHealth https://t.co/6OxATPvBx9,"[{'text': 'Health', 'indices': [59, 66]}, {'text': 'Wellness', 'indices': [67, 76]}, {'text': 'MentalHealth', 'indices': [77, 90]}]",2020-10-06 20:30:09
"UCSF, San Francisco","The novel coronavirus (COVID-19) outbreak has resulted in widespread school and child care closures. Family Services is promoting various resources that may be helpful for UCSF faculty, staff, trainees and students. https://t.co/E86wFeWghz https://t.co/Bbh9VVYbeg",[],2020-10-06 20:30:09
"Los Angeles, CA","New: There are now 123 front-line workers in the Capitol complex who have have tested positive—or are presumed positive—for COVID-19, according to House Admin GOP Spokesperson Ashley Phelps.

Story coming.",[],2020-10-06 20:30:08
"New York, NY","In this COVID-19 economy, industrial and manufacturing companies that transform their cost structure with the right strategic mindset will emerge stronger. Learn how here. https://t.co/0IFej6GeH0 #Costtransformation #Fitforgrowth https://t.co/LfC8Cc19v9","[{'text': 'Costtransformation', 'indices': [196, 215]}, {'text': 'Fitforgrowth', 'indices': [216, 229]}]",2020-10-06 20:30:08
"Los Angeles, California","https://t.co/iVtw6CWJFX ""Students and COVID-19: We Are Struggling, Here’s the Help We Need""",[],2020-10-06 20:30:07
New York,The president is now holding a COVID-19 stimulus package hostage to try and win the election.,[],2020-10-06 20:30:06
"Los Angeles area, California,","After Facebook and Twitter deleted his posts containing factual inaccuracies about the risks of Covid-19, Trump called for the repeal of Section 230, the law that protects internet free speech. https://t.co/czSilIgLUe",[],2020-10-06 20:30:05
Miami,".@brikeilarcnn discusses how President Trump and Fox News are dangerously spinning the lethality of Covid-19 and selling Trump's Covid-19 diagnosis as ""the sacrifice of a true leader."" https://t.co/p39XNp6ykt",[],2020-10-06 20:30:05
"New York, NY","Multiple surveys and studies are beginning to document the broader health effects of the #COVID-19 pandemic, including missed #cancer screenings and #immunizations because of fear of contagion. @AmJNurs #nursingessentials
https://t.co/0k9pS0JBZT","[{'text': 'COVID', 'indices': [89, 95]}, {'text': 'cancer', 'indices': [126, 133]}, {'text': 'immunizations', 'indices': [149, 163]}, {'text': 'nursingessentials', 'indices': [203, 221]}]",2020-10-06 20:30:04
New York,"Trump Halts Covid-19 Relief Talks Until After Election 
https://t.co/1AaiHY9rk2",[],2020-10-06 20:30:03
NEW YORK CITY,"#BidenCares about families being able to pay their rent and feed their kids. 

Trump and Congressional Republicans, meanwhile, are turning their backs on them by refusing to crush the #coronavirus and moving forward to destroy people's pre-existing condition protections. #Vote","[{'text': 'BidenCares', 'indices': [16, 27]}]",2020-10-06 20:30:02
"Los Angeles, CA","Nancy Pelosi is asking for $2.4 Trillion Dollars to bailout poorly run, high crime, Democrat States, money that is in no way related to COVID-19. We made a very generous offer of $1.6 Trillion Dollars and, as usual, she is not negotiating in good faith. I am rejecting their...",[],2020-10-06 20:30:02
"Miami, FL","A recovery in retail sales is underway amid COVID-19, but there are challenges ahead https://t.co/kIGcPPlR0Y",[],2020-10-06 20:30:02
"Chicago, IL",The Covid-19 pandemic has shaped the economic landscape of our country. It's also dramatically shifting how businesses work and operate. Thanks Rebecca Hanson from @RainfactoryInc for sharing your insights in our latest #roundupblog ➡️ https://t.co/kUBUc5SPth https://t.co/3W3VJb4K4u,"[{'text': 'roundupblog', 'indices': [220, 232]}]",2020-10-06 20:30:02
Central New York,"New York's new ""Cluster Action Initiative"" focuses on taking dramatic action within COVID-19 clusters by imposing limits on houses of worship, mass gatherings, businesses, dining, and schools
https://t.co/9YxPddhVNW",[],2020-10-06 20:30:00
Los Angeles,"#BidenCares about families being able to pay their rent and feed their kids. 

Trump and Congressional Republicans, meanwhile, are turning their backs on them by refusing to crush the #coronavirus and moving forward to destroy people's pre-existing condition protections. #Vote","[{'text': 'BidenCares', 'indices': [16, 27]}]",2020-10-06 20:30:00
San Francisco,"Lt. Cdr. Jayna McCarron, the White House Military Office aide who often carries the nuclear ""football"" which follows the president at all times and provides access to the US nuclear arsenal, has contracted COVID-19. She last traveled with Trump to Bedminster NJ
h/t @AtomicAnalyst https://t.co/ee3cDOWriI",[],2020-10-06 20:29:58
Los Angeles,"After returning to the White House yesterday, President Trump — who is still an active coronavirus patient — removed his mask for a photo op.
https://t.co/aZ2HNHlHqM",[],2020-10-06 20:29:57
New York ,"New: There are now 123 front-line workers in the Capitol complex who have have tested positive—or are presumed positive—for COVID-19, according to House Admin GOP Spokesperson Ashley Phelps.

Story coming.",[],2020-10-06 20:29:55
"Los Angeles, CA","I tested positive for COVID-19 this past Friday while on assignment at the White House the weekend before covering the Supreme Court nominee announcement in the Rose Garden.

I am quarantining in my apartment in DC and am beginning to feel better, and of course staying positive! https://t.co/OPFYvM6KJ7",[],2020-10-06 20:29:55
"Chicago, IL",Poll: 74 percent of voters want Senate to take on COVID-19 relief before SCOTUS nominee https://t.co/sRBRRKy9ky https://t.co/c8Le58UhjW,[],2020-10-06 20:29:55
"Los Angeles, CA","FAIRhealth recently released this study putting the average cost of a hospital stay with Covid at $73,300, or (ignoring the helicopter ride, fancy rooms, and ongoing care) what trump would pay in taxes in 97.75 years. https://t.co/lOLcVH8OXL",[],2020-10-06 20:29:55
"New York, USA","After Facebook and Twitter deleted his posts containing factual inaccuracies about the risks of Covid-19, Trump called for the repeal of Section 230, the law that protects internet free speech. https://t.co/czSilIgLUe",[],2020-10-06 20:29:51
New York,"Our free 3-part workshop series on #socialwork &amp; #COVID19 continues tomorrow with Part II, ""COVID-19 Patients &amp; Their Families from a Social Work Perspective"" featuring experts from @nyulangone @MountSinaiNYC &amp; @MontefioreNYC. RSVP: https://t.co/SfZFisRm3p https://t.co/4mS6sRKpcf","[{'text': 'socialwork', 'indices': [48, 59]}, {'text': 'COVID19', 'indices': [66, 74]}]",2020-10-06 20:29:51
"New York, NY 🇺🇸🇵🇷",".@JoeBiden again tests negative for COVID-19:

“Vice President Biden underwent PCR testing for COVID-19 today and COVID-19 was not detected,” the campaign advises (h/t pool @rubycramer)",[],2020-10-06 20:29:50
"Los Angeles, CA","When you die of COVID-19, you die alone. https://t.co/egpA4u9tNT",[],2020-10-06 20:29:49
"New York, NY 10011","The President should NOT end relief negotiations until after the election if he and @FLOTUS is confirmed positive for COVID-19. This will cause panic @POTUS @realDonaldTrump
@TomFitton @dbongino @NBCNews @NBCNightlyNews @TodayinNewYork @MSNBC @CNBC @UnivisionNews @TLMDPR @V2019N",[],2020-10-06 20:29:48
"Chicago, IL","New: There are now 123 front-line workers in the Capitol complex who have have tested positive—or are presumed positive—for COVID-19, according to House Admin GOP Spokesperson Ashley Phelps.

Story coming.",[],2020-10-06 20:29:46
new york,Here is a look at the growing number of White House staff and senior Republicans who have contracted COVID-19: https://t.co/Zb8GSGHady https://t.co/Sa3ftkVpe0,[],2020-10-06 20:29:44
San Francisco,"New: There are now 123 front-line workers in the Capitol complex who have have tested positive—or are presumed positive—for COVID-19, according to House Admin GOP Spokesperson Ashley Phelps.

Story coming.",[],2020-10-06 20:29:41
"Los Angeles, CA","#BidenCares about families being able to pay their rent and feed their kids. 

Trump and Congressional Republicans, meanwhile, are turning their backs on them by refusing to crush the #coronavirus and moving forward to destroy people's pre-existing condition protections. #Vote","[{'text': 'BidenCares', 'indices': [16, 27]}]",2020-10-06 20:29:41
los angeles,"New: There are now 123 front-line workers in the Capitol complex who have have tested positive—or are presumed positive—for COVID-19, according to House Admin GOP Spokesperson Ashley Phelps.

Story coming.",[],2020-10-06 20:29:38
San Francisco,We regret to announce two additional deaths due to COVID-19. One individual was a LatinX male in his late 70s. Coronavirus was a contributing factor in his death. The other was a LatinX female in her mid-80s. Coronavirus is listed as the primary cause of death.,[],2020-10-06 20:29:38
"Los Angeles, CA","Nancy Pelosi is asking for $2.4 Trillion Dollars to bailout poorly run, high crime, Democrat States, money that is in no way related to COVID-19. We made a very generous offer of $1.6 Trillion Dollars and, as usual, she is not negotiating in good faith. I am rejecting their...",[],2020-10-06 20:29:34
"Los Angeles, CA","BREAKING AZ Covid News— 2,815 COVID hospitalizations REMOVED from Arizona’s official tally. From Dr Cara Christ’s blog, “a large healthcare provider was reporting an admission date for COVID-19 cases when these individuals were not actually hospitalized.”  https://t.co/SGwrqUDMvI",[],2020-10-06 20:29:33
